WISEID,Answer,KIScore
118535.0,if the car was left outside for a week in a hot temperature and this one day was cold its more than likely that the car is going to be warmer than the cold air outside,2
149963.0,i chose that the car is warmer than the outside air because when a car sits in the sun for a long time it gets warmer than the outside air,2
151201.0,becuse every temperture is the same,2
139747.0,akbar s car acts as an insulator which contains cold and heat inside the car got absorb by the cold air from the outside of the car,2
151218.0,it s because since it is in the sun for a week then it s probably gonna be a little warm,2
118579.0,it is warmer than the outside air because it has been in the sun all day and that heats up the car,2
118312.0,i think it is warmer than the outside air because on some days we leave our car parked in the sun and than we go in the car and its warmer than the outside air,2
153992.0,cause that happens to my mom,2
150061.0,i chose warmer than the outside air because it is sitting in the sun,2
118412.0,the sun is warming the car up and the wind is only affecting the outside of the car,2
154344.0,i think the temperature would be the same as the outside air because the air out side is cold and it makes the inside of the car also cold,2
154112.0,it will be warmer because i have experienced this before,2
151217.0,the car has been in the sun for a week,2
149587.0,heat is the absence of cold so heat got into the car because hot things move towards cold things and cold things dont transfer anywhere so it wpuld have to be cold outside and warmer inside,2
136508.0,i chose warmer than the outside because at first when the was coming the car was the same temperature as the outside but the air was stuck in the car for weeks and the air did not move or change and the sun even in a cold day can change the temprature in the car,2
136364.0,the car hes been sitting in the sun for a week and the heat will be trapped inside the car,3
150116.0,the car would be out for a long time in the sun which would become hot,3
153864.0,it s warmer then the outside because outside the car there is wind and has probably changed weather several times where inside the car it doesn t release air so that it stays the same temperature until it gets hot and then in the car it gets warmer,2
136509.0,because you put the a c on in the car,2
136481.0,if the engine has not been turned on for a whole week the i predict that the car will be a little bit warmer than the temperature as the outside surroundings why i think this is because the engine usually heats up the front of the car and if akbar owner of the car felt cold he would of turned off the heater inside the car and it will have a different temperature for quite a while,2
118518.0,i think that the car will be colder than the air outside because the car will trap in the air that is outside and have the air in the car become colder than the air outside,2
118543.0,it is going to be colder because the coldness is going to go inside of the car and mix the cold air and the hot air together but then the heat is going to be gone because there is so much cold air that the car will turn cold,2
153844.0,if he has parked his car in the sun and left it there for a week then the inside of the car is going to be more warm than outside because the inside of the car is usually more warm and i has been left there for a long time in the sun so it should be more warm,2
154318.0,i think that it is warmer then outside because its been there for a week and its been in the sun for a week and that is why i think that it is warmer inside,2
139850.0,it would be colder because it would be colder outside to start with and nobody has entered in the car aswell making it cold as days pass,2
118632.0,i think it will be the same temperature inside like it is outside,2
118354.0,the weather out side is cold and he has left his car in the sun but because he left his car in the sun does not in will warm because he has not used it for a week so it has to be cold inside,2
118404.0,i said colder then the outside air,2
153981.0,i am guessing the car is going to be colder just because from past experiences i have gotten into a car in the sun on a cold morning before and it has been slightly colder than outside in this case akbar hasn t been in his car causing it to be colder because of the lack of body heat,2
139798.0,it is warmer inside the car than outside because the heat has been inside the car for a long time,2
151211.0,i pick that answer because if it was in the sun for a week then the sun would have reflect on the glass there for it would make it very hot over time,2
150090.0,because i ve had exeperience with this when you havnt drove your car in a while and its hot outside it will be more hot in the car thats why you should not keep dogs in the car on hot days,2
153982.0,when it is hot outside inside the car is way hotter i know this because on summer days my moms car is hot inside,2
150128.0,it is warmer because it is in the sun and has been in the sun for a week,2
118585.0,it will be cooler because its cold at night and it hasnt been used for a couple od days,2
153906.0,it matters on the day it happened because at night it is cold and in the morning it is cold so it would be cold,2
118298.0,its because the car is in the sun for a week and the sun is hitting the car for a long time that why i think it will be warmer than the air outside,2
150214.0,i think it going to be warmer because in a car it is always warmer,2
150198.0,the reason i think this is because the car itself has not been driven for a week and we dont know the weather from the day before that which could have been warmer also even if it was a cold day it was still parked in the sun which gives it more heat than what the temprature is outside,2
153848.0,i think it will be warmer because today is the only cold day the other days could have been hot days,2
118454.0,it has absorbed all this cold air so its really cold,2
139853.0,it s warmer because it attracts heat so heat will be trapped inside,2
118319.0,because the temperature can change because it might have been hot one day but it says it was cold so the temperature changed to the cold,2
150086.0,because she s in the car,2
154133.0,why it will be cold in the car because when he left the car in the coldness for a week the car gets colder by the day so when its thier for a week the car will be freezing the next time he goes in the car,2
154329.0,because if the sun is shining in the car and its cold outside it would maybe the exact weather,2
151218.0,it s because sometimes on days it can be very hot,2
136555.0,the heat came in through the window and the heat could not come out because the heat reflected from the window,3
118371.0,i think that the answer is going to be the air inside the air is warmer than outside because it has been sitting in the sun for a week,2
150160.0,it will be hotter because the more you leave something out in the sun the hotter it will get,3
154138.0,because the air stays in the car and it heats up,2
154314.0,the sun was keeping the inside of the car warm in the cold air while it has not been driven for a week,2
150062.0,i think that akbar s car is warmer than the outside air because it has been parked for a week in the hot sun,2
118516.0,the car is warmer than the air outside because if the car is in the sun then it will heat up the inside maybe because the seats are leather which makes it hot also i have been in car so in my car the steering wheel gets hot and also the buckle gets hot,2
154201.0,if it was a hot day and your car was parked outside the car sit would heat up and the hot air inside would be exactly the same heat as outside,2
154199.0,if a car is standing in the sun the car would get heated up inside,2
150900.0,it actually depends if the person has the windows up or down,2
118306.0,well my hipothisis is that the car is warmer than the outside air because it might have absorbed some of the hot air outside,2
154152.0,i know that it would be warmer because all the hot air is going inside for a week and none of the air is coming out and just some of the seats stay warm,3
150129.0,the sun is beating down on the car and making the inside of the car hotter,3
150910.0,because the sun shines on the car when it s hot outside,2
136451.0,most cars from the st century have insulators in the inside roof of the car,2
151225.0,because when you open the door the air comes in the car,2
118469.0,the car hasn t been driven or even had people in it for a week so the car must be cold,2
136551.0,yes because it has been out in the sun for a week and if you have leather seats it will be hot then you when you get in the car all the metal stuff will be hot,2
118583.0,because it would store up the coldness,2
151200.0,i can infer that it is cold in the car because it is a cold day,2
154310.0,its going to be warmer than the outside air because the sun makes the car moisturize,2
118473.0,its cold ount side and when drive a car u have to wait until its warm so its probely the car will be cold maybe there is wind out side maybe the window might be open,2
139819.0,it would normally be colder than the outside air but since its out in the sun it ll cancel the coldness out,2
118411.0,the sun heats up the car even on a cold day,2
136413.0,the car was in the sun longer than it was in the cold it has also not been used at all,2
118392.0,well if the car is black in the inside and the sun is out the color black would absorb the heat and stay warm until the sun is goes down,2
154197.0,the car would have been exactly the same because even though it was in the sun the cold would have also affected the inside and outside,2
136387.0,the car has been sitting outside for a week so the overall temperature will be about the same,2
151178.0,i would say that the car would be warmer than the air because even though it is cold it has been sitting out in the sun for a week heating it up,3
136388.0,i think the air inside the car is going to be warmer based on personal experience on a hot day my mom and i had to go somewhere and the day before we didn t even use the car in was sitting in the sun and it was really hot inside i had to leave my door open while i was waiting for my mom to hurry up,2
118349.0,i think it is the same as outside because usely when we our on a trip and we dont use are car for a while cause we use another on and its cold outside its usely the same temputer as the air outside,2
118313.0,if it is in the sun the heat goes directly towards it and keeps it warm,2
150245.0,i chose this answer because the cold air outside combines with the air inside which creates even colder air on the inside,2
154316.0,warmer because the car kept in the heat,2
150168.0,the reason why i chose the answer in the middle is because the car is parked in the sun,2
139511.0,a car contains metal which are good conductors of heat if you leave a car out in the sun for a very long time the air inside the car will be unbearable to be in and will be much hotter than the outside temperature because there is no room for the air to escape so the air molecules will keep bouncing around inside the car same for cold temperature on the outside the car will feel much more colder inside than the outside if it is snowing or something like that,2
154217.0,even if it is cold but on the sunny side it is cold in side but it is hot out side,2
118402.0,colder because it has been out there overnight,2
154212.0,i think this because if it is a cold day than the air in the car would most likely be warmer than the outside it also has been in the sun for a whole week,2
150083.0,i think it would be warmer than the outside because its gust sitting in the sun and it hasn t been driven for a week,2
118352.0,the car may be exactly the same as the air outside because the engine may be shut down the engine is a car s source of heat,2
118467.0,it may be the same as the outside because when its night the car can cool down and then the next day the car can get warmed up again,2
118367.0,because on a cold day akbar walks to his car and he was parked in the sun he haven t droven it for a week,2
153992.0,cause my moms car is the same temp in outside,2
150149.0,since the car has been parked in the sun for a whole week i think that it will be a little warmer than the outside air because the car is all locked up and nothing can get inside,3
150922.0,because it is in the sun which will make it warm while the outside is cold,2
150200.0,i chose warmer than the outside air because it was in the sun for seven days and not driven and it was only one cold night,2
151198.0,it s warmer because it s been out in the sun for a week so i would expect it to be hot,2
150235.0,the car was out for a week so it was out longer than the cold was,2
118472.0,i think it s the same temperature as outside because the car is in the sun but at the same time the weather is cold,2
118300.0,if all the windows are up then its going to be really warm,2
154129.0,i think the air temperature inside the car is warm because if it were in the sun the whole time for a week it would be warm it would also depend on the car color inside and out because if it were black then it would bring sun s beams of heat to the car if white or any other color it would bring as much heat as a black car but the cold air might make it cooler because he just opened the car door and the car s air would mix with the cold and become cooler than it did before hand,2
154143.0,becuase when you get in the seat is cold unless you put hot air but still it is the same,2
151195.0,because it been sitting in the burning sun for a week,2
118597.0,his car will be hot because it as parked in the sun for a hole week,2
118585.0,its warmer than out side because theres some wam air inside the car,2
136403.0,i think his car is colder than the outside air because it has been sitting in the sun for a week but it was cold a old day when akbar went to his car even though the sun is shining on it and it it hasn t been driven for a week it is still probably colder than the outside air,2
136397.0,i think that it will warmer because i have heard that cars are degrees hotter than outside,2
150178.0,i choose this answer because when its a cold day the inside of the car gets cold too,2
