WISEID,Answer,KIScore
154149,Its so it's easy to place and it will block most of the air.,2
154129,I does this because it will reflect out.,3
154156,Because inside is blocking the sun heat and won't get in the heat.,2
154915,It should face out of the car so the radiation hits the sun shade and bounces away.,4
153993,The shiny part should face the outside so the sun bounces of the car.,4
153816,"The shiny side should face outwards so it reflects the sun's rays, keeping the car cool.",4
153818,"If the shiny part is outside, then it will reflect more light and heat up less.",4
153822,she should put the shiny side first because the shiny side will have the sun reflect off of the car.,4
153823,Out of the car because it will reflect off of the shinny part.,3
153824,"The shiny part will reflect heat, making it go into the outside atmosphere, not he atmosphere of the car. if the shiny part was in the inside, the heat would just bunch up in the car shade.",3
153826,because if it is already shiny it will not be affected by the sun so the inside of the car will stay cool.,2
153827,put it inside so if the sun wants to get inside the car o if you put them on the inside thn it will block th sun from coming in,3
153830,The shiny part will reflect the sunlight from the car so the energy goes outwards instead of in the car.,4
153831,Out because then it will deflect the heat rays.,3
153832,The shinny one is better it reflects the sun,4
153834,The shiny part makes it so that the sun stays on the out side because the shiny part attracts sun.,3
153835,She should put the shiny part on the outside because if she put it o the inside the hiny part might atract heat,2
153836,If it was facing out of the car the sun would atract to it and it would make the car hotter.,3
153837,Toward the out of the car because then the sun can reflect off something.,4
153838,i chose inside of the car because sun react to leather,2
153843,because if you put it on the out side it will just blow away but on the inside it keeps sun out and it won't blow,3
153844,because the sun if facing it so it would be shiny.,3
153845,"I think the shiny part  it should be on the  outside of the car because it would be blocking the sun from the outside.
The not so shiny part should be on the  inside of the car just to make sure the sun is not getting in it",3
153848,I think it is out of the car because if she has it on the non shiny part facing out then it will attract more heat. So it is better to have it on the shiny side facing up. You want the shiny side facing up! Like who would want more heat in their car! You always want to stay cool!,2
153852,outside of the car because it will reflect the bright light back,4
153854,So then the heat will bounce on and off of the car. Then the car wont get to hot.,3
153856,Because she is trying to get the heat from coming inside of the car.,2
153859,because it will let the heat bouce off the siver panil,3
153863,For the shine will shine on the other side,2
153864,it should face outside the car because that is the side where it shines light away.,3
153905,The shinny affect reflects the sunlight off the car.,4
153906,Because it will reflect the suns rays so it will not be as hot,4
153908,So the shiny one reflects the sun out of the way!,4
153909,the shiny side would attract the sun rays the non shiny would bounce it back.,4
153910,So the sun will face the other way from the shiny side. It also works like a mirror so if the sun faces the outside the shiny part will make it reflect the other way.,4
153911,i think the suns rays maybe bounce off the shiny side and back into the sky or space ans the other side keeps more darkness so more shade,4
153913,because it can keep your car cool inside and some one might steal it,2
153914,I think the shiny side will attract the sun more.,3
153915,if its outside it wont do anything,2
153916,So the sunlight reflects off of it.,4
153917,I think think because it will work.,2
153918,if its inside the glass will get hotter,2
153919,I chose this so the sun could hit it and reflect right back into the atmosphere,4
153921,Out of the car because then the heat will get into your car but the shinny part will protect the inside.,2
153922,shiny things also reflect the sun,4
153923,I think it should be going out because than the radiation will bounce out.,4
153924,if you put the tin out side it put more heat in the car,2
153925,it keeps your car cool,2
153926,Out of the car because if the sun hits the shiny part it will reflect of the sun shade. If it faces the inside of the car the sun can come through a car an reflect into the inside of the car.,4
153927,because if it is in the inside it wont be hot,2
153928,It has to be facing towards the sun or outwards because the sun reflect on it.,4
153929,It will reflect off the sun makeing it go in different derections,4
153930,It would face out so the sun reflects off it and it does not make the car hot.,4
153931,inside the car because it would protect the sun from inside,3
153932,inside the car because someone can sele them,2
153935,"I chose the inside of the car because when you have it inside it will shade everything, but when you put it on the outside it won't shade everything and so some things will get really hot.",2
153936,toward the inside of the car that why is not go to get hot,2
154112,It should face the out the car so the heat goes another way.,2
154118,the shiny surface wil reflect the sun,4
154119,It will warm up the car again if the dark side (not shiny) is pointing to the sun. The lighter colors keep the car cool.,3
154122,so the not shiny would be less hot,2
154124,It should be facing out because it will reflect the heat and light outside.,4
154127,I chose this because if the shiny part faces out of the car it will repel the sunlight.,3
154128,The shiny part will reflect the rays from coming in.,4
154130,"it has a out and it protest it for no heat to come in,",2
154132,it should be facing the outside because then it will reflect the sun,4
154134,Out of the car because the sun will reflect on the outside of the car.,4
154135,it should go to the outside because the shiny part is like a difflector mirror so it will defflect the suns rays,4
154141,It will reflect the sun outside of the car.,4
154143,inside because i seen it in real life to protect the seat and handle.,2
154145,It should face the out of the car so that the shiny part can  make the light to go the other direction.,4
154147,If you do it in the outside then it wont be as effective as if you place inside.,2
154148,because you need the shinny part to block out the sun and keeping the car cool.,3
154150,it protects,2
154152,Because my mom has one and she puts it on the  inside and it is cold after.,2
154153,Because the shny gets out,2
154162,it would reflect the suns light into the sky and would not go through.,4
154193,the shine will make the sun and the light rebound and will not let the heat get inside.,3
154194,The shiny part of the shade will not absorb the energy but will reflect it making it bounce off and out of the car. The other side will absorb the energy and will let the energy through. This is why you would put the shiny side to the outside and not inside,5
154195,The shiny parrt faces outside because then the suns energy can be reflected back to its source,4
154196,I choice this because if it is in the car facing in the car will take the heat of the sun.,3
154197,"The sunlight will be absorbed through the shiny part and will go through the sun shade and into the car, making it hot.",3
154198,The shiny part will reject the heat and go outside of the car,2
154199,Out of the car because then the heat would make the sun would reflect back making the heat not able to get into the car.,4
154200,it should face the outside because when the sun comes the shiny side reflects off the car. and doesn't make it a hot.,4
154201,I picked this answer because the hat won't be attracted to the car.,2
154202,"the shiny part would act as a mirror, making the light go the other direction, making it the valid choice.",4
154204,out of the ca because it wiill not be hot,2
154205,The foil will face the sun and outside the wind can blow it away.,2
154206,So the heat doesn't touch the glass and makes it hotter.,2
154207,She should be it toward the inside of the car because if she puts it out side of the car the wind cold blow it away and if in the inside the wind wont blow it away,2
154208,The shiny part reflects the solar energy away from the car.,4
154210,It should show on the outside because then it would reflect the sun.,4
154211,the shiny side would reflect the sun so it should face the outside.,4
154212,i think this will work better because the sun will preject of it and have the sun not come in the side the car.,3
154214,because the shiny part will reflect the sun,4
154215,because it cant fall down,2
154216,The shade make the sun not point in.,3
154218,so the sun doesn't reflect into the car and if the shades are there then the sun wont go into the car,4
154220,i dont know,1
154221,if you had it the otherway around the the sun would bounce off the blocker and in the car.,4
154224,Out of the car because you do not want,2
154226,If it in the outside it is going to burn.,2
154228,because it hits the sun faster.,2
154307,I think it's best to put it on the inside of he car because then the sun shade will make the inside cool.,2
154318,because i just think that and it is hard to explain,1
154319,I believe this because is the shiny part is facing outside the shiny part of the sun shade will soak up the radiation instead of the radiation just passing by the sun shade.,3
154321,I think it should face the outside of the car so the sun will reflect off of it,4
154322,"i am not for sure, but maybe if it is against the sun the heat will bounce back.",4
154323,so it reflects,3
154324,"If it is facing toward the car, it won't make a difference but if it faces away it will reflect the heat.",3
154325,"If you faced the shiny side to the person, the non shiny part will just absorb the sunlight, thus making it hot, if you made the shiny part face the sun, it will deflect the light and make the light face another way, this way it does not heat up the car.",5
154326,If it is on the outside of the car than the sun will reflect of of it.,4
154327,out of the car so the heat/light reflects off of it,4
154329,outside so the heat does not reflect in side the car.,3
154330,You should keep in toward the inside of the car because it will keep all he cool air in and bloke the hot air out and keep the car cool.,2
154335,So the sun will reflect itself out of the car and keep away the sun.,4
154336,buces if outside it will bolw away,2
154337,The part that Laura would like is that her car is not that hot when she gets her car back. If he protects the car from the inside than it will not heat up has much. The outside of the car is going to be hot but the inside is not if it is protected by the shield.,2
154342,It would face the outside to reflect sun rays from hitting the inside of the car,4
154343,i think its better fror the thing to be out side  because it wont het up the car,2
154345,So inside the car does not get heat but the outside get some heat ad it might blow away when it outside.,2
154353,so she can still see well she is diving and it will be cooler,2
154371,Becouse it reflects the light,4
154155,it blocks the the heat rays of the car,3
154151,i dont  no,1
153824,"The shiny part of the car shade should be facing outwards because when the solar radiation hits the car shade, if the shiny side is facing outward, the solar radiation will be reflected elsewhere.",4
153822,She should put it on the out of the car because then the sun will reflect off into another place so the car will not heat up.,4
153844,I think toward the inside of the car because when i was doing the solar ovens my partner and I put tin foil outside to attrack heat so maybe if we face it towards the inside maybe it will not attrack so much heat.,2
153852,We chose out of the car because we're trying to keep heat from coming inside of the car.,2
153838,Toward's the inside because the sun would cause convection to the sun an if you have the shed blocker right in front it would not  react to the glass.,3
155053,It should be facing the outside of the car to bounce sunlight off of it to keep the front of the car from getting hot.,4
153831,Because the heat will reflect out and will not let the heat in.,3
153816,Shininess reflects radiation,4
153823,Out of the car because the sun will reflect off of the shinny part.,4
153837,Outside of the car so the heat can reflect off the shade into the atmosphere. Also because the car wouldn't heat up as much.,3
153864,"You should put the shiny part toward the outside of the car because, you want the sun rays to bounce away from the car instead of inside the car.",4
153923,So the sun's radiation ca bounce off.,4
153928,"Out the car because the sun rays has to reflect on something back out, if you put the dark side facing out the sun rays wont reflect but it will probably get absorbed.",5
153909,"The shiny part should face the outside of the car because the shiny part will reflect the light back towards the sun, keeping the car cool inside.",4
153913,So the heat can bounce of the car and not inside.,3
153917,because it will reflect the sun out of the car,4
153916,The shiny part should face outside the car because it will reflect any sunlight and keep Laura's car cool.,4
153935,I picked toward the inside of the car because when it's on the outside of the car some of the heat can still get into the car.,2
153922,shiny things reflect sun off of that object,4
153921,Out of the ar because it will reflect away from the car but if you have it inside it will reflect inside the car and make it hotter.,3
153911,the not shiny part is like a shade for the inside of the car,2
153930,If it faces inside the car nothing happens. If you face the shiny part out of the car then it will reflect off the light and that's what you want.,4
154112,She should put it on the outside because then sun will reflect off it and shine it somewhere else.,4
153926,If the sun hits the shiny part facing the outside of the car then it will just reflect back. If it faces the inside of the car and the sun is at angle and hits it then it will reflect into the inside of the car.,4
153908,Out the car so it reflects back out of the car so heat doesn't get trapped in the car.,4
153905,The shiny surface would result in radiation being reflected away from the car.,4
153918,if its insid the glass would get hotter,2
153906,It will reflect the suns rays.,4
153919,It should be the facing the outside of her car becaue it will make the radiation hit it and reflect it back into the atmosphere.,4
153914,You would want the shiny side facing out side because then the sun will reflect off of it and not into the car.,4
153927,because when it is on the out side it will stay collor on the inside,2
154135,so the heat will reflect even more.,3
154124,The shiny part should be facing the outside of the car to reflect the light outside of her car.,4
154132,Because the shiny part will reflect the sunlight like  tinfoil flap on a solar oven.,4
154162,the glass would make it hotter.,2
154134,The shiny part should face out of the car to reflect the sun rays out of the car.,4
154153,so it will reflect.,3
154118,it will reflect the sunlight back.,4
154155,it will reflect the UV rays off the car.,4
154119,Toward the inside of the car because if it was toward the outside of the car the heat would be absorbed into the car. The dark color will block the heat instead of absorbing it.,3
154130,i chose that because it refease that sun out out of the car inside .,3
154150,i would do the shinny side becasyye it wouldn't absorb the heat so it would reflct from it.,4
154122,Cause the shiny side will reflect the heat.,3
154127,I chose out of the car because shiny materials reflect energy while non,4
154143,because the the out side car is hot and it has tinfoil and when it up it can get on fire,2
154128,"The shiny part reflects light, so you want it facing were the sun will hit and it will reflect out of the car.",4
154141,You want to have the shiny side facing out of the car so the sun can hit the windshield than reflect out of the car. If you use the inside of the windshield its not shiny and its a dark color so more sun can hit the windshield.,4
154145,It should face out of the car because when the sun reflects on the shiny part it would reflect in front.,4
154208,The shiny part will reflect radiation.,4
154202,The shiny part would reflect the light outwards and away from the car.,4
154193,The shiny will reflect the heat out so the heat wont get inside of the car.,3
154200,well when the sun hits he carsthe sun will bounc off the windshield,4
154206,The shiny part will reflect some solar radiation.,4
154212,i think this because it would reflect the heat out of the car and get it so not as much gets inside the car.,3
154214,because it will reflect heat and not absorb it.,4
154218,well if it is facing out of the car then the sun will hit it and then reflect back to it.,4
154221,The shiny side will also attract heat and then the sun shade will heat up.,2
154226,if she does it in the out side of the car it's going to heat up and the car will become more hotter.,2
154217,so your seats wont get hot and it will be a little cold but not alot of it just a little,2
154199,Out of the car because the shiny side will reflect the heat and sun off.,4
154198,If the shiny part faced out the window would get really hot,2
154215,beause it could fall outside or it coud be stolen.,2
154196,I chose this because if it is facing the outside of the car it will reflect the suns radiation outward.,4
154201,The sun will not affect the car and everything inside so it won't heat up fast.,3
154205,If the windshield is outside of the car the car is more likely to get heat inside the car because the reflector is outside.,2
154197,Out of the car because the shiny part will reflect heat from getting into the car.,3
154204,It should face the outside out of the car because then the car will stay cool then facing the shiny part on the inside because the car because the the car will gt hotter if the shiny part is inside the car.,2
154195,I think the reflector should face out of the car because it will reflect the heat energy away from the car's windshield.,4
154311,it will reflect the heat to the other side and t will go out side.,3
154322,the shiny side should show to the outside of the car because the heat can reflect off of the car.,3
154310,I tink it would be the inside of the car because the con vonvection can still go through if its on the outside but in the inside in wont go through,2
154327,Out of the car so the incoming light will reflect off of it.,4
154326,the shiny part will reflect the sun away from the car.,4
154324,It will reflect heat if it is facing away from the car because it is shiny and if it faces at the car it just reflects the heat back in the car.,3
154319,I beleive this becaue it acts like a reflector reflecting radiation away from her car instead of the radiation hittting her car.,4
154343,the foil type matirial refects the radiation and keeps the car from getting to hot inside,4
154307,The out of the car because since it is shiny then the light will reflect off the windshield and not touch her car.,4
154371,becase it bounces the heat out so it does not let it in.,3
154353,because it wont fly off the car windows.,2
154336,beacuse the sun will reflect off the shiny part,4
154325,"If the shiny part faced the inside of the car, the non-shiny part will absorb all the heat which would make it hotter on the inside. If you put the shiny part towards the outside of the car, it will deflect the heat because of its shinyness and how reflective it is.",4
154329,Toward inside the car because then if the sun hits the shiny part it will be hot when you touch it.,3
154323,the shiny part will reflect the sun,4
154345,To keep inside the car cooler.,2
154703,because if it is facing in words it would be hot because the sun reflects in the car.,4
155334,Because it dog,1
153836,"The more reflective side reflects solar rays better than the other side, she does not want heat into the car so having the reflective side would work best to keep out heat and solar rays.",4
153834,"The shiny part will reflect the heat out, keeping the car cool.",3
153863,If it is reflecting the outside of the car it will have the sunlight go in a different direction.,4
153843,if it is on the outside it will blow away but on the inside it will stay and protect the heat,2
153826,It will reflect the light away from the car,4
153848,If you have the shiny side facing out then when the heat hits the sun shade it will reflect out of the car. If you have it the other way round then it will attract more heat. Who would want to walk into a hot car?,3
153835,The shiny side will reflect the heat out of the car instead of inside the car so the heat won't go into the car it will reflect out of the car.,3
153860,If it is faces the outside of the car it will reflect the light off of the car.,4
153827,if they were out side there would be little cracks,2
153830,You need the shiny part facing outward so the sunlight can reflect off of it which would send the heat away from the car.,4
154514,out of the car because when the sun hits the car the shiny part will reflect the suns rays out.,4
153859,it will block the heat better,2
153832,it will reflect the sun away from the car cooling it of,4
153854,The heat will see the shiny part of the cover and the sun will try to warm up the car but the heat will bounce right out of the car and back to the  atmosphere.,4
153839,If it faces the outside of the car the sun will not get trapped inside the car because if the shinny.,4
153818,The shiny side of the sunshade reflects more radiation from the sun so it cant be absorbed and turned into heat.,5
153915,so then the shiny part wont reflect of the glass,3
153925,that will keep the inside cool.,2
153912,Radiation,2
153924,if you put it in the in side for it could hit the glass and go back,2
154148,Because if we face it out the light will bounce out of the car keeping it cool.,4
154152,Because it keeps the car more cold and if its in the outside then it can fly away,2
154160,because it makes it colder.,2
154157,I think you should use it toward the inside because if you put it out of the car someone can rob it and you want it to be cool inside,2
154147,I chose the inside because the windshield blocks the most of the uv light from the outside and the windshield block the heat from the inside.,3
154159,because the wind sheald bloks the heat frome the out side petects it frome the inside.,2
154161,The reason is that if you put the side that is shiny the car won't get really hot.,2
154146,Outside because the lighter part will make he sun go away. So ya like I said pick the lighter side.,3
154211,The shiny part should face the outside because it would reflect the heat away from your car.,3
154210,The shiny part will reflect the heat backwards.,3
154318,Outside of the car because ot will reflect the light.,4
154194,The shiny part will reflect the energy and sunbeams out of the car.,4
149950,Because if the dark side is facing out the son goes into it.,2
149966,The shiny stuff will reflect the suns heat.,3
149972,"That will keep most heat from entering and let heat that has entered, escape.",2
149959,because someone driving down her street can get blinded because the shiny part is very shiny,2
149953,The shiny things attract less things than usual.,2
149970,The shiny part reflects the heat.,3
149590,because the shiny part will reflect the sun and make it stay away from the car,4
149956,it does not effect that mich,2
149961,it reflects the sun,4
149588,"Out of the car because if the shiny part is inside, then it will go through the fabric and will get the car hotter.",3
149955,I think this because it cam only observe the shiny part,2
149967,so the sun cant go in the car to keep it cool,3
150648,I choose out of the car because then the sun can reflect off of the shiny side,4
149965,The shiny part should face outside the car because the Sun will reflect back.,4
149962,pointing to the outside of the car can block the sun,3
149971,so it won't get hot inside,2
150065,"The shiny part would reflect heat from the car.  If the non-shiny part faced out and the shiny faced in, the shiny would reflect the rays of sun trying to get out.",4
150066,I think it should go inside the car because then it would bounce the heat off the car and back into the air. If you do it on the outside of the car then it could go in a different direction and the heat will transfer in the car.,2
150074,To make sure that the light does not get attracted to the dark side.,3
150076,"I am not sure for this question, but I think the shiny part of her windshield should be facing inside the car. I thought of these questions while I was thinking about it. Can it attract heat too? If people walk past my car, the shiny part can hurt their eyes.",2
150073,The shiny part will attract heat,2
150078,The shiny side reflects the sun.,4
150072,"I chose out of the car because when the metal sheet is faced towards the sun, it reflects the sun off the car.",4
150075,It should  face outwards so that the sun's rays reflect off the shiny part.,4
150077,"When heat reflects on something shiny, the heat will bounce off of the material and not be as hot.",3
150069,This is my answer because picture 2 is trying to keep the sun out so its kind of absorbing up all the sun that wants to get into the car.,3
151162,if its out of the car then the metal outside of the car will be hot instead of the inside.,2
150052,I picked that one because it reflects the sun from coming inside the car.,4
150067,so it reflects the sun,4
